id,conversation_id,created_at,date,time,timezone,user_id,username,name,place,tweet,language,mentions,urls,photos,replies_count,retweets_count,likes_count,hashtags,cashtags,link,retweet,quote_url,video,thumbnail,near,geo,source,user_rt_id,user_rt,retweet_id,reply_to,retweet_date,translate,trans_src,trans_dest
1506471610601345028,1506471610601345028,2022-03-23 04:23:15 +01,2022-03-23,04:23:15,+0100,3007765140,goodreturnska,Kannada Goodreturns,,"ಮಾ.23: ಪೆಟ್ರೋಲ್, ಡೀಸೆಲ್ ಬೆಲೆ ಏರಿಕೆ, ಪ್ರಮುಖ ನಗರದ ದರ ಪಟ್ಟಿ #petrol #diesel #russia #ukraine #fuel #india #goodreturnsoriginal  https://t.co/qBzg7rKwAu",kn,[],['https://kannada.goodreturns.in/news/petrol-and-diesel-prices-hiked-on-23rd-march-2022-check-rates-in-your-city-013012.html'],[],0,0,0,"['petrol', 'diesel', 'russia', 'ukraine', 'fuel', 'india', 'goodreturnsoriginal']",[],https://twitter.com/GoodreturnsKa/status/1506471610601345028,False,,0,,,,,,,,[],,,,
1506468735288193027,1506468735288193027,2022-03-23 04:11:49 +01,2022-03-23,04:11:49,+0100,64634804,nirmalbang,Nirmal Bang,,"Petrol, diesel rates rise by 80 paise per litre for second straight day.  Watch now:  https://t.co/QKSuG3ZwnQ  #TradeSetup #Trademarket #USStocks #AsianMarket #Europe #Ukraine #Russia #MarketUpdate #Nifty #GlobalMarkets #CrudeOil",en,[],['https://youtu.be/fcypLgaGqP8'],[],0,0,2,"['tradesetup', 'trademarket', 'usstocks', 'asianmarket', 'europe', 'ukraine', 'russia', 'marketupdate', 'nifty', 'globalmarkets', 'crudeoil']",[],https://twitter.com/NirmalBang/status/1506468735288193027,False,,0,,,,,,,,[],,,,
1506467215864111104,1506122049412026369,2022-03-23 04:05:47 +01,2022-03-23,04:05:47,+0100,1470767766659604480,sarojrajparwanp,SAROJ SAH,,@yadavakhilesh Ukraine and Russia war then today all the country ⛽ Gas and petrol problems. I thought next time M.R MODI AND M.R YOGI solve this problem....JAY..SHREE RAM...,en,[],[],[],0,0,0,[],[],https://twitter.com/SAROJRAJparwanp/status/1506467215864111104,False,,0,,,,,,,,"[{'screen_name': 'yadavakhilesh', 'name': 'Akhilesh Yadav', 'id': '57948579'}]",,,,
1506463504223592452,1506463504223592452,2022-03-23 03:51:02 +01,2022-03-23,03:51:02,+0100,1464579986942214147,webnewson,Web News On,,Petrol and diesel prices on March 22 Tamil Nadu budget 2022 Tamil Nadu Agriculture Budget 2022 Ukraine Russia news today  https://t.co/SXweb6vqVp,en,[],['https://webnewson.com/petrol-and-diesel-prices-on-march-22-tamil-nadu-budget-2022-tamil-nadu-agriculture-budget-2022-ukraine-russia-news-today/'],[],0,0,0,[],[],https://twitter.com/webnewson/status/1506463504223592452,False,,0,,,,,,,,[],,,,
1506453418155466752,1506204352326762502,2022-03-23 03:10:58 +01,2022-03-23,03:10:58,+0100,1315128883235102721,himmat88851655,Himmat,,"@ShyamMeeraSingh Give me name of one country that is a heavy importer of crude like India &amp; yet has lower price of petrol ! Moron, world over prices have shot up because of Russia Ukraine war, this has nothing to do with Modi",en,[],[],[],0,0,0,[],[],https://twitter.com/Himmat88851655/status/1506453418155466752,False,,0,,,,,,,,"[{'screen_name': 'ShyamMeeraSingh', 'name': 'Shyam Meera Singh', 'id': '1099547584371347457'}]",,,,
1506453175515025410,1506453175515025410,2022-03-23 03:10:00 +01,2022-03-23,03:10:00,+0100,38647512,indianexpress,The Indian Express,,#ExpressFrontPage | The prices of both petrol and diesel are expected to rise further as crude oil prices have increased sharply due to the Russia-Ukraine conflict.   https://t.co/o4mFmy3k8n,en,[],['https://bit.ly/3L6sWBA'],[],2,2,8,['expressfrontpage'],[],https://twitter.com/IndianExpress/status/1506453175515025410,False,,0,,,,,,,,[],,,,
1506448770279800832,1506448770279800832,2022-03-23 02:52:29 +01,2022-03-23,02:52:29,+0100,26452286,chris_gore,Chris Gore,,Rising Petrol Prices &amp;#8211; Is Russia-Ukraine to blame?  https://t.co/TQN3UDcxjC,en,[],['https://clsapremium.com.au/rising-petrol-prices-is-russia-ukraine-to-blame/'],[],0,0,1,[],[],https://twitter.com/chris_gore/status/1506448770279800832,False,,0,,,,,,,,[],,,,
1506435238292963330,1506422432001052672,2022-03-23 01:58:43 +01,2022-03-23,01:58:43,+0100,712970085523017728,rathinakumar49,K Rathinakumar,,"@Srinivasan1304 @ANI_MP_CG_RJ @bhupeshbaghel Don't you know the prices of Petrol,Diesel  and gas prices were raised even before the war of Russia and Ukraine  ?",en,[],[],[],1,0,0,[],[],https://twitter.com/rathinakumar49/status/1506435238292963330,False,,0,,,,,,,,"[{'screen_name': 'Srinivasan1304', 'name': 'Srinivasan NA', 'id': '752776592716247040'}, {'screen_name': 'ANI_MP_CG_RJ', 'name': 'ANI MP/CG/Rajasthan', 'id': '69544090'}, {'screen_name': 'bhupeshbaghel', 'name': 'Bhupesh Baghel', 'id': '731388034244055040'}]",,,,
1506428428232310788,1506418212199890944,2022-03-23 01:31:40 +01,2022-03-23,01:31:40,+0100,1464832482176548864,yonnimus,yonnimus,,"@brzec @SFatirNaeem @spectatorindex Russia can't make tanks or weapons, they're dying in droves, they can't advance in the field, they have no morale, they have no food or petrol. Meanwhile, Ukraine is on the counter-attack, resilient, prepared to keep fighting and kill them all. Russian soldiers will leave or die.",en,[],[],[],1,0,0,[],[],https://twitter.com/yonnimus/status/1506428428232310788,False,,0,,,,,,,,"[{'screen_name': 'brzec', 'name': 'Grzegorz Brzęczyszczykiewicz', 'id': '1101101522161676288'}, {'screen_name': 'SFatirNaeem', 'name': 'Fatir Naeem', 'id': '1101413144'}, {'screen_name': 'spectatorindex', 'name': 'The Spectator Index', 'id': '1626294277'}]",,,,
1506417029645221891,1506395737499705353,2022-03-23 00:46:22 +01,2022-03-23,00:46:22,+0100,795899346101252096,misslucy_2011,MissLucy,,@MelissaLDavey I’m really angry with Russia. Once the War stops the global issues affecting petrol &amp; food prices will normalise. Normalise to Covid times anyway. But the War won’t stop until Russia stops or Ukraine give in or give up. And we don’t want the latter to happen.,en,[],[],[],0,0,0,[],[],https://twitter.com/MissLucy_2011/status/1506417029645221891,False,,0,,,,,,,,"[{'screen_name': 'MelissaLDavey', 'name': 'Melissa Davey', 'id': '289732005'}]",,,,
1506392079043334148,1506135177721958401,2022-03-22 23:07:13 +01,2022-03-22,23:07:13,+0100,542173715,shockmusyoki,Shock Davies,,"@NationAfrica The time Uhuru became President 1Lt of Petrol costed 68/-. I guess Ukraine and Russia began war in 2013. Secondly, I want Kenyans to know that their fuel in Turkana is Sold by 1 family and they have branded it RUBIS",en,[],[],[],0,0,4,[],[],https://twitter.com/ShockMusyoki/status/1506392079043334148,False,,0,,,,,,,,"[{'screen_name': 'NationAfrica', 'name': 'Nation Africa', 'id': '25979455'}]",,,,
1506381713617960962,1506381713617960962,2022-03-22 22:26:02 +01,2022-03-22,22:26:02,+0100,20882066,mahmuttor,Mahmut Tör,,"In this century, they REFINED the petrol but POLLUTED the information   Don’t Believe Everything you hear or read. #RussiaUkraine #StopTheWar",en,[],[],[],0,0,3,"['russiaukraine', 'stopthewar']",[],https://twitter.com/MahmutTor/status/1506381713617960962,False,,0,,,,,,,,[],,,,
1506375622813179911,1506375622813179911,2022-03-22 22:01:50 +01,2022-03-22,22:01:50,+0100,1501305060889960454,pwalianelson,Nelson Pwalia,,"I'm very much disappointed on the NPP defenders who blame Russia n Ukraine war on the price of fuel. How much was the price b4 the war n how much is the price now, we have a lot of tax on petrol, the cedi has depreciate badly and the corruption going on at the harbor.",en,[],[],[],0,0,0,[],[],https://twitter.com/PwaliaNelson/status/1506375622813179911,False,,0,,,,,,,,[],,,,
1506359856558608388,1506222577727176704,2022-03-22 20:59:11 +01,2022-03-22,20:59:11,+0100,1403666863268110343,chakrabortywb,𝓒𝓱𝓪𝓴𝓻𝓪𝓫𝓸𝓻𝓽𝔂𝓦𝓑 🌍,,@priyankagandhi Diesel-petrol and cooking gas prices will rise. You should know that there is a war going on between Ukraine and Russia and India buys crude oil from Russia every year.And the biggest thing is that Modi government is repaying the loan taken by your government.,en,[],[],[],0,0,0,[],[],https://twitter.com/ChakrabortyWB/status/1506359856558608388,False,,0,,,,,,,,"[{'screen_name': 'priyankagandhi', 'name': 'Priyanka Gandhi Vadra', 'id': '1094645942735855618'}]",,,,
1506344961930891267,1506344961930891267,2022-03-22 20:00:00 +01,2022-03-22,20:00:00,+0100,20045552,peterheadcbe,Peter Head,,New Zealand halves public transport fares as petrol prices soar amid Russia-Ukraine war. Hugely better impact than reducing fuel tax and encouraging more emissions. ⁦@RishiSunak⁩   https://t.co/wwzqrwplB1,en,"[{'screen_name': 'rishisunak', 'name': 'rishi sunak', 'id': '1168968080690749441'}]",['https://www.theguardian.com/world/2022/mar/14/new-zealand-halves-public-transport-fares-as-petrol-prices-soar-amid-russia-ukraine-war'],[],0,1,6,[],[],https://twitter.com/PeterHeadCBE/status/1506344961930891267,False,,0,,,,,,,,[],,,,
1506332082703847428,1506332082703847428,2022-03-22 19:08:49 +01,2022-03-22,19:08:49,+0100,1440952990043709441,justis4u3,Jus Tis (Latest Unsuspended Account),,"If #Russia and #Ukraine agreed a deal and #russia was able to supply #Europe with cheap #gas and #petrol, then the #USA &amp; @NATO #war industries won't be able to sell any #arms &amp; #Western #Zionist governments would not be able to enslave its citizens with debts for high prices",en,"[{'screen_name': 'nato', 'name': 'nato', 'id': '83795099'}]",[],[],1,0,1,"['russia', 'ukraine', 'russia', 'europe', 'gas', 'petrol', 'usa', 'war', 'arms', 'western', 'zionist']",[],https://twitter.com/Justis4u3/status/1506332082703847428,False,https://twitter.com/damian_from/status/1506234638058020867,0,,,,,,,,[],,,,
1506317840965545985,1506317840965545985,2022-03-22 18:12:13 +01,2022-03-22,18:12:13,+0100,1306199428294795265,gulamemadani,Moin Ali 🌹🌹🌹🌹🌹🌹,,"#Gas,#petrol &amp; #Diesel are purchased on a few year contract &amp; the amount is fixed. Each country already has large reserves. But why are pre-purchased goods expensive? The #war between #Ukraine &amp; #Russia has been going on for a month. #PetrolDieselPriceHike #Inflation #gasprices  https://t.co/rrINOg93gx",en,[],[],['https://pbs.twimg.com/media/FOeEFhWUYAMxHgg.jpg'],1,0,0,"['gas', 'petrol', 'diesel', 'war', 'ukraine', 'russia', 'petroldieselpricehike', 'inflation', 'gasprices']",[],https://twitter.com/GulameMadani/status/1506317840965545985,False,,1,https://pbs.twimg.com/media/FOeEFhWUYAMxHgg.jpg,,,,,,,[],,,,
1506314790393679872,1506265320268656640,2022-03-22 18:00:06 +01,2022-03-22,18:00:06,+0100,315902323,srinivasan114,Srinivasan2406,,"@SivaSubiramani3 Across the world petrol prices are going up because of Russia-Ukraine war. For the Marxist/Maulana/Missionary media n India alone it will go up because of Modi, very soon !",en,[],[],[],0,0,1,[],[],https://twitter.com/Srinivasan114/status/1506314790393679872,False,,0,,,,,,,,"[{'screen_name': 'SivaSubiramani3', 'name': '🇮🇳Siva Subiramanian🇮🇳', 'id': '1213640257997963266'}]",,,,
1506313313763815425,1506222577727176704,2022-03-22 17:54:14 +01,2022-03-22,17:54:14,+0100,1395422476180459521,lollibrandu7896,LoLLibrandu,,"@priyankagandhi Russia aur Ukraine je beech jang chal raha hai aur sabko pata hai ki iski wajhe se Petrol,Diesel aur Gas ki rates badhenge.Sabko ye baat pata hai agar apko pata nhi hai toh me apse sirf ek baat bolna chahunga -  https://t.co/bktcbRPyRq",hi,[],[],['https://pbs.twimg.com/tweet_video_thumb/FOd_9qmaAAAJrqc.jpg'],0,0,0,[],[],https://twitter.com/LoLLibrandu7896/status/1506313313763815425,False,,1,https://pbs.twimg.com/tweet_video_thumb/FOd_9qmaAAAJrqc.jpg,,,,,,,"[{'screen_name': 'priyankagandhi', 'name': 'Priyanka Gandhi Vadra', 'id': '1094645942735855618'}]",,,,
1506310988634763274,1506310988634763274,2022-03-22 17:45:00 +01,2022-03-22,17:45:00,+0100,296831514,herefordtimes,Hereford Times,,Petrol prices in Hereford continue to rise as Russia’s invasion of Ukraine but the average cost of fuel is falling nationally.  https://t.co/8DYia7HXb8,en,[],['https://www.herefordtimes.com/news/20012118.cheapest-petrol-prices-hereford-average-costs-dip/'],[],0,0,0,[],[],https://twitter.com/herefordtimes/status/1506310988634763274,False,,0,,,,,,,,[],,,,
1506310889120669706,1506309766259384323,2022-03-22 17:44:36 +01,2022-03-22,17:44:36,+0100,7587032,skynews,Sky News,,"How much have prices at the pump changed?  Just under two years ago, petrol prices reached a four-year low during the COVID pandemic.  But recently, wholesale costs have been rising sharply, partly due to Russia’s war in Ukraine   https://t.co/TOxsMi2yK9  https://t.co/aLaT7o2teN",en,[],['https://trib.al/GuluXdN'],['https://pbs.twimg.com/media/FOd82qEWQAIBXRd.png'],3,1,12,[],[],https://twitter.com/SkyNews/status/1506310889120669706,False,,1,https://pbs.twimg.com/media/FOd82qEWQAIBXRd.png,,,,,,,[],,,,
1506305750519398403,1506285096889950223,2022-03-22 17:24:11 +01,2022-03-22,17:24:11,+0100,1026068175522340865,nprezident,#1CCC 🧡💛,,"@drjaytee87 @DrChada_ Hike  like Petrol, Russia 🇷🇺 Ukraine 🇺🇦 yakwidza ⛽😜 am told she is a Doc England 🇬🇧,  she home 🏡Zimbabwe 🇿🇼 crying  over  ⛽.  😳  https://t.co/ysNfZXZB5c",en,[],[],"['https://pbs.twimg.com/media/FOd5F-XXIAAyW9x.jpg', 'https://pbs.twimg.com/media/FOd5GL3XEAEdWcS.jpg']",1,0,0,[],[],https://twitter.com/NPrezident/status/1506305750519398403,False,,1,https://pbs.twimg.com/media/FOd5F-XXIAAyW9x.jpg,,,,,,,"[{'screen_name': 'drjaytee87', 'name': 'skilled rebhara', 'id': '335750593'}, {'screen_name': 'DrChada_', 'name': 'Dr R.K Chada 🇿🇼🇺🇸', 'id': '1505925839514484739'}]",,,,
1506305021066899457,1506048860472299524,2022-03-22 17:21:17 +01,2022-03-22,17:21:17,+0100,2907191887,yourpathakgmai1,पाठक दिनेश,,@ANI Sir Why are you interested to Join NATO? You know this is the main reason of war between Ukraine and Russia. Now NATO N US only putting petrol in this situation. Please to save Ukrainian think about the way of peace.,en,[],[],[],0,0,0,[],[],https://twitter.com/yourpathakgmai1/status/1506305021066899457,False,,0,,,,,,,,"[{'screen_name': 'ANI', 'name': 'ANI', 'id': '355989081'}]",,,,
1506303618038784005,1506303618038784005,2022-03-22 17:15:42 +01,2022-03-22,17:15:42,+0100,1480604093357998088,phillyiee2,Phillyiee,,Australians Continue to Endure Record High Petrol Prices as Russia-Ukraine War Drags on  https://t.co/PKFy6yolqf,en,[],['https://link.theepochtimes.com/mkt_app/australians-continue-to-endure-record-high-petrol-prices-as-russia-ukraine-war-drags-on_4353487.html?utm_source=appan2029090'],[],0,0,0,[],[],https://twitter.com/phillyiee2/status/1506303618038784005,False,,0,,,,,,,,[],,,,
1506300439540604934,1506089098427383813,2022-03-22 17:03:05 +01,2022-03-22,17:03:05,+0100,1487894999497080834,justmythought89,JustMyThoughts,,@AbhishBanerj @nhk_varma Yeah petrol was rs 20 before russia ukraine war. Nice logic ✌🏻 Just because u support a specific political party/person dont post crap on twitter pls !!,en,[],[],[],0,0,1,[],[],https://twitter.com/JustMyThought89/status/1506300439540604934,False,,0,,,,,,,,"[{'screen_name': 'AbhishBanerj', 'name': 'Abhishek', 'id': '797673785268715521'}, {'screen_name': 'nhk_varma', 'name': 'nhkv', 'id': '152459424'}]",,,,
1506295683543875584,1506255014863331335,2022-03-22 16:44:11 +01,2022-03-22,16:44:11,+0100,1202400568943271936,buddhas_the,The Buddha's Socks,,"@NadiaInBC @WesClarkjr @davetroy I have never been to Ukraine but I know many Ukranians...and like the Polish, Hungarians, Rumanians,Mildivans,Georgiana,Chechens, Baltic States etc nobody want s anything to do with Russia (but for buying gaz &amp; petrol). Nobody .... Why would they ?",en,[],[],[],4,0,0,[],[],https://twitter.com/buddhas_the/status/1506295683543875584,False,,0,,,,,,,,"[{'screen_name': 'NadiaInBC', 'name': 'NadiaInBC', 'id': '1165027684423913472'}, {'screen_name': 'WesClarkjr', 'name': 'Wesley Clark', 'id': '723200033634439173'}, {'screen_name': 'davetroy', 'name': 'Dave Troy 🌻', 'id': '4848301'}]",,,,
1506295187332608001,1506294631163645961,2022-03-22 16:42:12 +01,2022-03-22,16:42:12,+0100,1424819538600804358,shan03tl45,Shan,,@siasatpk @khaledanam1 Pata chal jayaga in Jahilo ko world ma jo coronavirus ka bad aur Ukraine Russia ka bad mehangae aye ha uska government ma kitna control kia hua ha jab ya tmhara corrupt 2number masiha ayainga to petrol 260 ka milaga jo sub chezain mehanga kar daga,in,[],[],[],0,0,0,[],[],https://twitter.com/Shan03tl45/status/1506295187332608001,False,,0,,,,,,,,"[{'screen_name': 'siasatpk', 'name': 'Siasat.pk', 'id': '45075214'}, {'screen_name': 'khaledanam1', 'name': 'khaled anam', 'id': '841991552'}]",,,,
1506294428616515585,1506294428616515585,2022-03-22 16:39:12 +01,2022-03-22,16:39:12,+0100,294753652,luisherreramesa,Luis Herrera Mesa,,New Zealand halves public transport fares as petrol prices soar amid Russia-Ukraine war   https://t.co/iioFPWJxPF,en,[],['https://www.theguardian.com/world/2022/mar/14/new-zealand-halves-public-transport-fares-as-petrol-prices-soar-amid-russia-ukraine-war'],[],0,0,0,[],[],https://twitter.com/luisherreramesa/status/1506294428616515585,False,,0,,,,,,,,[],,,,
1506292597437960201,1506292597437960201,2022-03-22 16:31:55 +01,2022-03-22,16:31:55,+0100,1415562093839872003,huntdailynews1,HuntdailyNews,,LIVE: Petrol-Diesel के दामों में बढ़ौतरी | Russia Ukraine | Imran Khan | CM Yogi Oath | नमस्ते भारत  https://t.co/ffpvF5aVkB,und,[],['https://huntdailynews.in/live-petrol-diesel-%e0%a4%95%e0%a5%87-%e0%a4%a6%e0%a4%be%e0%a4%ae%e0%a5%8b%e0%a4%82-%e0%a4%ae%e0%a5%87%e0%a4%82-%e0%a4%ac%e0%a4%a2%e0%a4%bc%e0%a5%8c%e0%a4%a4%e0%a4%b0%e0%a5%80-russia-ukraine-imra/'],[],0,0,0,[],[],https://twitter.com/HUNTDAILYNEWS1/status/1506292597437960201,False,,0,,,,,,,,[],,,,
1506286426828201992,1506000784785219608,2022-03-22 16:07:24 +01,2022-03-22,16:07:24,+0100,170386574,shashank1320,Shashank Singh,,@venakabhochuka @ChokshiHardik @Navnath53494677 Wahi na jo Ukraine ka ho gaya? Ukraine ko bas Russia ka darr hai. Apne desh ka socho Charon taraf se ghira hua hai fir bhi sambhale hue hai. Jada dukh hai to petrol pee lo aur aag laga lo. Khud ka ghar to logo se chalta nahi 4 logo ka aur sochte hai kursi wala sabka chala de,hi,[],[],[],0,0,2,[],[],https://twitter.com/shashank1320/status/1506286426828201992,False,,0,,,,,,,,"[{'screen_name': 'venakabhochuka', 'name': ""Rajeev'neeraj'"", 'id': '1504802544983605250'}, {'screen_name': 'ChokshiHardik', 'name': 'hardik chokshi', 'id': '1123953600'}, {'screen_name': 'Navnath53494677', 'name': 'शिंदें (पाटील)', 'id': '1448200076237557761'}]",,,,
1506286020484075527,1505989070815694848,2022-03-22 16:05:47 +01,2022-03-22,16:05:47,+0100,1467792324696547330,arifjan56746601,Arif Jan,,@ShibaInuHodler If the war of Russia 🇷🇺 and Ukraine 🇺🇦 stop then it will be possible know people are suffering from other issues petrol ⛽ prices going high the gas shortage is also in Europe,en,[],[],[],0,0,0,[],[],https://twitter.com/ArifJan56746601/status/1506286020484075527,False,,0,,,,,,,,"[{'screen_name': 'ShibaInuHodler', 'name': 'SHIB HODLER 🐕', 'id': '1411587179986489346'}]",,,,
1506285798987120654,1506285798987120654,2022-03-22 16:04:54 +01,2022-03-22,16:04:54,+0100,782605382300667904,jimbolucale,jumbo,,"#powerdrive @Thabisoo @Fifi_CM we really need counseling. Petrol is up, Government doing nothing except to tell us about Ukraine and Russia. Interest rates going up. Food prices are going up. ANC needs people who have thinking capacity and not the current once we have.  https://t.co/0P1fpQgQ27",en,"[{'screen_name': 'thabisoo', 'name': 'thabiso kotane', 'id': '41087923'}, {'screen_name': 'fifi_cm', 'name': 'refiloe cm', 'id': '1244737752'}]",[],['https://pbs.twimg.com/media/FOdm8XaXoAA0zkX.jpg'],0,0,0,['powerdrive'],[],https://twitter.com/jimbolucale/status/1506285798987120654,False,,1,https://pbs.twimg.com/media/FOdm8XaXoAA0zkX.jpg,,,,,,,[],,,,
1506282676151808000,1506213355463528451,2022-03-22 15:52:30 +01,2022-03-22,15:52:30,+0100,1392687245388259337,yugendr64599495,Yugendran,,@kaavitamilan1 @AravindRajaOff Black money ah olipom... employment ah increase pannuvom..... India va develop pannuvom.... Russia Ukraine crises nadhandalum petrol diesel price erathu..... Etc,fr,[],[],[],0,0,1,[],[],https://twitter.com/YUGENDR64599495/status/1506282676151808000,False,,0,,,,,,,,"[{'screen_name': 'kaavitamilan1', 'name': 'SATHISH KUMAR BJP🚩🇮🇳', 'id': '1384765252043120643'}, {'screen_name': 'AravindRajaOff', 'name': 'Dr.Aravind Raja', 'id': '1292809092742787072'}]",,,,
1506279392447991808,1506279392447991808,2022-03-22 15:39:27 +01,2022-03-22,15:39:27,+0100,315902323,srinivasan114,Srinivasan2406,,Across the world petrol prices are going up because of Russia-Ukraine war. For the Marxist/Maulana/Missionary media n India alone it will go up because of Modi very soon !,en,[],[],[],1,0,0,[],[],https://twitter.com/Srinivasan114/status/1506279392447991808,False,,0,,,,,,,,[],,,,
1506266285004693514,1506165888613228544,2022-03-22 14:47:22 +01,2022-03-22,14:47:22,+0100,61430926,mmoinz,Mohammed Moin,,@yippeekiyay_dk Pradhan sewak came he asked petrol ke dam kam huwe ke nahi Naseebwala kaha khud ko aaj halat bure se bure ho gaye. ab kya kahoge Russia-Ukraine war Kuch bhi kaho 2024 mein aaye ga to _________?,hi,[],[],[],0,0,0,[],[],https://twitter.com/mmoinz/status/1506266285004693514,False,,0,,,,,,,,"[{'screen_name': 'yippeekiyay_dk', 'name': 'Mr.Fixit', 'id': '1239890903143047168'}]",,,,
1506265772141785089,1506265772141785089,2022-03-22 14:45:19 +01,2022-03-22,14:45:19,+0100,1453448235968876552,louisaradice,Louisa Radice,,New Zealand halves public transport fares as petrol prices soar amid Russia-Ukraine war   https://t.co/Olvdp7dSiW,en,[],['https://www.theguardian.com/world/2022/mar/14/new-zealand-halves-public-transport-fares-as-petrol-prices-soar-amid-russia-ukraine-war'],[],0,0,0,[],[],https://twitter.com/LouisaRadice/status/1506265772141785089,False,,0,,,,,,,,[],,,,
1506250923198320652,1506250923198320652,2022-03-22 13:46:19 +01,2022-03-22,13:46:19,+0100,2423522604,wandfmagazine,Wealth & Finance,,Fuel prices have stabilised for the first time this month after Russia's invasion of Ukraine caused a surge. 👉  https://t.co/GKy6V73Zvt  #petrol #diesel #oil #UK #fuel,en,[],['https://zcu.io/w3AC'],[],0,0,0,"['petrol', 'diesel', 'oil', 'uk', 'fuel']",[],https://twitter.com/wandfmagazine/status/1506250923198320652,False,,0,,,,,,,,[],,,,
1506241010837647360,1506241010837647360,2022-03-22 13:06:56 +01,2022-03-22,13:06:56,+0100,99900798,arghyapolley,Arghya Polley,,"Once again, petrol and diesel prices are on the rise, and looking at the current global turmoil, there is no immediate relief until this Ukraine and Russia tension subsides. However, in the aftermath, no heavy relief will be possible in the midterm as well.",en,[],[],[],1,2,3,[],[],https://twitter.com/arghyapolley/status/1506241010837647360,False,,0,,,,,,,,[],,,,
1506235498410520582,1506235498410520582,2022-03-22 12:45:01 +01,2022-03-22,12:45:01,+0100,562012974,ronlynn53,Ron Lynn,,Why is GBnews blaming Putin for increased petrol prices? They were rising long before Russia's military intervention in Ukraine! I am struggling to see the difference between GBnews and the mainstream media propaganda lately!  https://t.co/4sfq3TRN0u,en,[],['https://www.gbnews.uk/news/brits-told-work-from-home-three-days-a-week-and-ban-cars-on-sundays-to-beat-putin-energy-crisis/251212'],[],0,0,2,[],[],https://twitter.com/Ronlynn53/status/1506235498410520582,False,,0,,,,,,,,[],,,,
1506235227517362182,1506225434811596802,2022-03-22 12:43:57 +01,2022-03-22,12:43:57,+0100,1337037744602664961,mayurammurali,mayurammurali,,@sreeramjvc @News18TamilNadu Will anybody tell in the debate to visit Russia/Ukraine border to get cheap petrol?,en,[],[],[],0,0,1,[],[],https://twitter.com/mayurammurali/status/1506235227517362182,False,,0,,,,,,,,"[{'screen_name': 'sreeramjvc', 'name': 'Bulls Eye', 'id': '80070138'}, {'screen_name': 'News18TamilNadu', 'name': 'News18 Tamil Nadu', 'id': '739042814755901440'}]",,,,
1506230876526739461,1506121096458043397,2022-03-22 12:26:40 +01,2022-03-22,12:26:40,+0100,2780237299,v_dyals,Vibhu Dayal Sharma,,"@kaviyarani1 Go at Russia and Ukraine border and say them the price of LPG and Petrol is raised in India, ya maybe they stopped the war for easy supply of Oil and Gas to us and the other countries 😀😄😄and that will help us to raise up the issue for Govt here.",en,[],[],[],2,0,0,[],[],https://twitter.com/v_dyals/status/1506230876526739461,False,,0,,,,,,,,"[{'screen_name': 'kaviyarani1', 'name': 'kaviyarani', 'id': '1359755857051832320'}]",,,,
1506222098376757250,1506158299309244417,2022-03-22 11:51:47 +01,2022-03-22,11:51:47,+0100,139738411,meetsandyonline,sandeep kulkarni,,@RahulGandhi 😂😂this person doesn't understand anything... Every where petrol prices are raising due to Russia Ukraine war. Please don't misguide people,en,[],[],[],0,0,0,[],[],https://twitter.com/meetsandyonline/status/1506222098376757250,False,,0,,,,,,,,"[{'screen_name': 'RahulGandhi', 'name': 'Rahul Gandhi', 'id': '3171712086'}]",,,,
1506219976180617217,1506219976180617217,2022-03-22 11:43:21 +01,2022-03-22,11:43:21,+0100,1495131422616698888,journalistcnyt,Journalist_cuneyt,,#RussianUkrainianWar #RussiaUkraine #RusyaUkrayna Nizhny Novgorod bölgesinde yanan bir petrol deposunun görüntüleri 7 adet dizel yakıt deposu yanıyor.  https://t.co/mqQzJjKKrI,tr,[],[],[],2,0,0,"['russianukrainianwar', 'russiaukraine', 'rusyaukrayna']",[],https://twitter.com/Journalistcnyt/status/1506219976180617217,False,,1,https://pbs.twimg.com/ext_tw_video_thumb/1506219946237382658/pu/img/nL4bJzpS6E-WhHV5.jpg,,,,,,,[],,,,
