id,conversation_id,created_at,date,time,timezone,user_id,username,name,place,tweet,language,mentions,urls,photos,replies_count,retweets_count,likes_count,hashtags,cashtags,link,retweet,quote_url,video,thumbnail,near,geo,source,user_rt_id,user_rt,retweet_id,reply_to,retweet_date,translate,trans_src,trans_dest
1504447354207973383,1504431088898351105,2022-03-17 14:19:35 +01,2022-03-17,14:19:35,+0100,310522146,striglatricia,Tricia Giles,,@Independent Meanwhile in New Zealand... New Zealand halves public transport fares as petrol prices soar amid Russia-Ukraine war.,en,[],[],[],0,0,0,[],[],https://twitter.com/StriglaTricia/status/1504447354207973383,False,,0,,,,,,,,"[{'screen_name': 'Independent', 'name': 'The Independent', 'id': '16973333'}]",,,,
1504433818220269571,1503903662279921665,2022-03-17 13:25:47 +01,2022-03-17,13:25:47,+0100,1664149153,thewondersnatur,Roger (Blocked by rudy giuliani and donald jr LOL),,"@rightmanright1 @IAmPoliticsGirl russia is attacking Ukraine. america has sent aid to Ukraine to help, as they did back when Obama was president! We will never have petrol prices from decades ago. Also watch this video: Trump/Russia/Ukraine - All Pieces of the Same Puzzle  https://t.co/o9p0KFoYWg",en,[],['https://youtu.be/9rH1p66aigE'],[],1,0,0,[],[],https://twitter.com/TheWondersNatur/status/1504433818220269571,False,,0,,,,,,,,"[{'screen_name': 'rightmanright1', 'name': 'doright', 'id': '1480788994199744512'}, {'screen_name': 'IAmPoliticsGirl', 'name': 'PoliticsGirl', 'id': '3827830753'}]",,,,
1504423799063777288,1504423799063777288,2022-03-17 12:45:59 +01,2022-03-17,12:45:59,+0100,1167669981351313408,busines65959783,Business News,,"Expect volatility in petrol prices even as Russia-Ukraine conflict persists, say experts  https://t.co/Eh6aoSfqKw",en,[],['https://biz.blogdady.com/anticipate-volatility-in-petrol-costs-at-the-same-time-as-russia-ukraine-battle-persists-say-specialists/'],[],0,0,0,[],[],https://twitter.com/Busines65959783/status/1504423799063777288,False,,0,,,,,,,,[],,,,
1504423307738693633,1504423307738693633,2022-03-17 12:44:02 +01,2022-03-17,12:44:02,+0100,1443169289842819072,leong31440642,Tan Leong,,"Expect volatility in petrol prices even as Russia-Ukraine conflict persists, say experts  https://t.co/Jc2Xiiq6n0",en,[],['https://www.channelnewsasia.com/singapore/petrol-prices-crude-oil-volatility-russia-ukraine-conflict-2570996'],[],0,0,0,[],[],https://twitter.com/leong31440642/status/1504423307738693633,False,,0,,,,,,,,[],,,,
1504418580095553538,1504418580095553538,2022-03-17 12:25:14 +01,2022-03-17,12:25:14,+0100,1381003828045217798,globalcirculate,Global Circulate,,"Expect volatility in petrol prices even as Russia-Ukraine conflict persists, say experts  https://t.co/PnLKwAP6w8",en,[],['https://globalcirculate.com/expect-volatility-in-petrol-prices-even-as-russia-ukraine-conflict-persists-say-experts/'],[],0,0,0,[],[],https://twitter.com/GlobalCirculate/status/1504418580095553538,False,,0,,,,,,,,[],,,,
1504411395772755968,1504411395772755968,2022-03-17 11:56:42 +01,2022-03-17,11:56:42,+0100,1495730361342459906,clearbluesee,Clear Blue 🐋,,"PUTIN - Campaign proceeding well &amp; according to plan  “Our Russian forces have made strong progress toward Ukraine cities and once we stop losing planes, tanks &amp; soldiers, &amp; find some food &amp; petrol, expect to achieve.. wait why are we here?”  #ukraine #russia #UkraineUnderAttack  https://t.co/llGF4sW6Eb",en,[],[],['https://pbs.twimg.com/media/FOC-GfMVsAIvaLp.jpg'],1,1,4,"['ukraine', 'russia', 'ukraineunderattack']",[],https://twitter.com/ClearBlueSee/status/1504411395772755968,False,,1,https://pbs.twimg.com/media/FOC-GfMVsAIvaLp.jpg,,,,,,,[],,,,
1504406185851727874,1504406185851727874,2022-03-17 11:35:59 +01,2022-03-17,11:35:59,+0100,907527976434241536,advngcukaitobi,Not Adv Ngcukaitobi,,"But what has South Africa benefited from Russia? Shouldn't our petrol price be low sincewe are BRiCS members? Imagine if Zuma awarded Russia to build the nuclear plants,  we would have been fucked because of the Ukraine situation.",en,[],[],[],6,2,11,[],[],https://twitter.com/AdvNgcukaitobi/status/1504406185851727874,False,https://twitter.com/DZumaSambudla/status/1504392489519783940,0,,,,,,,,[],,,,
1504404697012002821,1504404697012002821,2022-03-17 11:30:04 +01,2022-03-17,11:30:04,+0100,38400130,channelnewsasia,CNA,,"Expect volatility in petrol prices even as Russia-Ukraine conflict persists, say experts  https://t.co/RqGaajYcjK  https://t.co/rLJMt3ornc",en,[],['https://www.channelnewsasia.com/singapore/petrol-prices-crude-oil-volatility-russia-ukraine-conflict-2570996?utm_source=dlvr.it&utm_medium=twitter'],['https://pbs.twimg.com/media/FOC4GYlVQAcdEBB.jpg'],0,1,5,[],[],https://twitter.com/ChannelNewsAsia/status/1504404697012002821,False,,1,https://pbs.twimg.com/media/FOC4GYlVQAcdEBB.jpg,,,,,,,[],,,,
1504402731716722688,1504402731716722688,2022-03-17 11:22:16 +01,2022-03-17,11:22:16,+0100,1500734415747825665,yarrah_muneer,Yarrah Muneer,,Sarah Henderson says that the cost of petrol has been driven by Russia's invasion on Ukraine.   @JournalismRmit,en,"[{'screen_name': 'journalismrmit', 'name': 'rmit journalism', 'id': '742585108108959745'}]",[],[],0,0,1,[],[],https://twitter.com/yarrah_muneer/status/1504402731716722688,False,,0,,,,,,,,[],,,,
1504395406532575233,1504395406532575233,2022-03-17 10:53:09 +01,2022-03-17,10:53:09,+0100,784464200,shaznacks,sharlotte r,,Petrol prices had been rising well before Russia invaded Ukraine #qanda,en,[],[],[],1,0,0,['qanda'],[],https://twitter.com/shaznacks/status/1504395406532575233,False,,0,,,,,,,,[],,,,
1504394898698813446,1504394898698813446,2022-03-17 10:51:08 +01,2022-03-17,10:51:08,+0100,20354511,georgiethomas,Georgie Thomas,,Petrol was close to $2 BEFORE Russia invaded Ukraine. We need to invest in renewables (…a decade ago) #qanda,en,[],[],[],2,17,53,['qanda'],[],https://twitter.com/GeorgieThomas/status/1504394898698813446,False,,0,,,,,,,,[],,,,
1504394674177720320,1504394674177720320,2022-03-17 10:50:15 +01,2022-03-17,10:50:15,+0100,261592680,sharonfajou,Sharon F,,Petrol was already almost $2 a litre before Russia attacked Ukraine. #qanda,en,[],[],[],0,1,9,['qanda'],[],https://twitter.com/sharonfajou/status/1504394674177720320,False,,0,,,,,,,,[],,,,
1504366957604356098,1504366957604356098,2022-03-17 09:00:07 +01,2022-03-17,09:00:07,+0100,14808226,euractiv,EURACTIV,,"Today in ""The Capitals"":  🇫🇷 France presents plan to curb impact of #Russia sanctions 🇩🇪 Germany investigates suspected gouging of #petrol prices 🇸🇪 Sweden is not ruling out additional weapons to #Ukraine   https://t.co/8k0ptgTVqv",en,[],['https://bit.ly/3CRuBrr'],[],0,1,2,"['russia', 'petrol', 'ukraine']",[],https://twitter.com/EURACTIV/status/1504366957604356098,False,,0,,,,,,,,[],,,,
1504358881425829888,1504358881425829888,2022-03-17 08:28:01 +01,2022-03-17,08:28:01,+0100,125239402,rjmontgomery,Roger Montgomery,,"Annual inflation is tipped to peak at around 4.75% during the second quarter this year. ANZ said that it had upgraded its forecasts due to pressures of the Russia-Ukraine war and flooding in NSW and QLD, most notably the impacts on petrol and food prices.  https://t.co/zVqF2ocQa0",en,[],['https://buff.ly/3wasWw0'],[],1,0,4,[],[],https://twitter.com/rjmontgomery/status/1504358881425829888,False,,0,,,,,,,,[],,,,
1504350600443703302,1503961045353865217,2022-03-17 07:55:07 +01,2022-03-17,07:55:07,+0100,1653189740,mmandla77,Mzansi citizens first🇿🇦,,"@AdvoBarryRoux You are stupid. We don't wanna know why Russia invaded Ukraine. That fool Putin had many stupid reasons, tales. fact is war is bad for everyone and it affects us here in SA. We don't support war!!! There is patrol involved to support those goods from Mozambique and already petrol",en,[],[],[],1,0,1,[],[],https://twitter.com/Mmandla77/status/1504350600443703302,False,,0,,,,,,,,"[{'screen_name': 'AdvoBarryRoux', 'name': 'Man’s NOT Barry Roux \uf8ff', 'id': '2449502355'}]",,,,
1504344279434420226,1504344279434420226,2022-03-17 07:30:00 +01,2022-03-17,07:30:00,+0100,1222332782543638528,inqldmedia,InQueensland,,"Motorists shouldn’t expect relief at the petrol bowser any time soon, even though global crude oil prices dropped further to below $US100 a barrel on hopes of progress in Russia-Ukraine peace talks. #oil #RussiaUkraineWar #Petrol  https://t.co/YlIP3W89zy",en,[],['https://inqld.com.au/news/2022/03/17/little-chance-of-relief-at-the-bowser/'],[],0,0,0,"['oil', 'russiaukrainewar', 'petrol']",[],https://twitter.com/InQldMedia/status/1504344279434420226,False,,0,,,,,,,,[],,,,
1504338256724439041,1504338256724439041,2022-03-17 07:06:04 +01,2022-03-17,07:06:04,+0100,2390810854,honeytoolz,"Seed🇿🇦😀🇮🇪,3x Unvaxxed",,the reason why petrol is expensive is due to the vaccinated...Bill Gates wants his pledged money from governments...so if you want to blame someone blame those who took the shot. Not Russia!! blame the state drug addicts! #VaccineSideEffects #gasprices #PetrolDieselPrice #Ukraine  https://t.co/x1L4Rs2Cjs,en,[],[],['https://pbs.twimg.com/tweet_video_thumb/FOB7qjQXoAMX2_z.jpg'],1,1,3,"['vaccinesideeffects', 'gasprices', 'petroldieselprice', 'ukraine']",[],https://twitter.com/HoneyToolz/status/1504338256724439041,False,,1,https://pbs.twimg.com/tweet_video_thumb/FOB7qjQXoAMX2_z.jpg,,,,,,,[],,,,
1504329205936496644,1504327686667264002,2022-03-17 06:30:06 +01,2022-03-17,06:30:06,+0100,1481225393319428097,gerrykipkemoi,Gerry Kipkemoi,,@K24Tv In particilar with cost fueling...does it mean that it's prices lift due to hoading of petrol to sustain Russia-Ukraine war?,en,[],[],[],0,0,4,[],[],https://twitter.com/GerryKipkemoi/status/1504329205936496644,False,,0,,,,,,,,"[{'screen_name': 'K24Tv', 'name': 'K24 TV', 'id': '20087934'}]",,,,
1504327965651308544,1504327965651308544,2022-03-17 06:25:10 +01,2022-03-17,06:25:10,+0100,283604227,andyvermaut,Andy Vermaut,,"Andy Vermaut shares:Roundup: South Pacific island nations witness food, petrol prices hikes: SUVA, March 17 (Xinhua) -- South Pacific island nations such as Fiji are far away from Russia and Ukraine, yet they have been significantly affected…  https://t.co/xpvvcHT3Ih Thank you.  https://t.co/4An6j22wpE",en,[],['http://www.beijingbulletin.com/news/272396646/roundup-south-pacific-island-nations-witness-food-petrol-prices-hikes?utm_source=dlvr.it&utm_medium=twitter'],['https://pbs.twimg.com/media/FOByUC1UYAQxJkG.jpg'],0,0,0,[],[],https://twitter.com/AndyVermaut/status/1504327965651308544,False,,1,https://pbs.twimg.com/media/FOByUC1UYAQxJkG.jpg,,,,,,,[],,,,
1504324852840222721,1504324852840222721,2022-03-17 06:12:48 +01,2022-03-17,06:12:48,+0100,68913959,camliveshere,Cam,,Going to make a prediction that once the price of oil isn’t attached to Russia invading Ukraine that fuel companies will continue to boost the price of petrol because now motorists are trained to accept it. #PetrolPrice #FuelPrice,en,[],[],[],0,0,3,"['petrolprice', 'fuelprice']",[],https://twitter.com/camliveshere/status/1504324852840222721,False,,0,,,,,,,,[],,,,
1504318892960718852,1504297729828089856,2022-03-17 05:49:07 +01,2022-03-17,05:49:07,+0100,2500619276,pn_naveen_,देशी जवान। jawan . जय हिंद। 🇮🇳,,"@rejitweets What about EU/NATO countries, who intimidate Ukraine for war against Russia. Are they importing white crude oil......... It's capacity to make better solution for our country. Are you supporting @INCIndia narrative ""modi will increase petrol price on 6 March """,en,"[{'screen_name': 'incindia', 'name': 'congress', 'id': '1153045459'}]",[],[],0,0,3,[],[],https://twitter.com/pn_naveen_/status/1504318892960718852,False,,0,,,,,,,,"[{'screen_name': 'rejitweets', 'name': 'Rejimon Kuttappan', 'id': '253023206'}]",,,,
1504305791481823236,1504304585602740226,2022-03-17 04:57:03 +01,2022-03-17,04:57:03,+0100,507704663,mbhodanedube,Mbhodane Dube entungwini,,@MorningLiveSABC #MorningLiveSabc this war will effect the whole world not only ukraine nw in south africa will have the petrol crisis why russia they not stop invading ukraine,en,[],[],[],0,0,0,['morninglivesabc'],[],https://twitter.com/MBHODANEDUBE/status/1504305791481823236,False,,0,,,,,,,,"[{'screen_name': 'MorningLiveSABC', 'name': 'MorningLiveSABC', 'id': '485644333'}]",,,,
1504304585602740226,1504304585602740226,2022-03-17 04:52:16 +01,2022-03-17,04:52:16,+0100,485644333,morninglivesabc,MorningLiveSABC,,"South Africans may face another increase on petrol and diesel prices of about R2 per litre amid rising international oil prices driven by #Russia’s invasion of #Ukraine.   School of Economics and Finance at Wits University, Lumkile Mondi, will be on #MorningLiveSABC.  https://t.co/VDJrH1l2RZ",en,[],[],['https://pbs.twimg.com/media/FOBdC3IXoAAyZDP.jpg'],11,4,13,"['russia', 'ukraine', 'morninglivesabc']",[],https://twitter.com/MorningLiveSABC/status/1504304585602740226,False,,1,https://pbs.twimg.com/media/FOBdC3IXoAAyZDP.jpg,,,,,,,[],,,,
1504297865237397507,1504281686384656385,2022-03-17 04:25:34 +01,2022-03-17,04:25:34,+0100,1288751118432923648,abetheape96,Abhinay,,"@nehem00 @rajiv132 @Swamy39 When petrol prices will rice and your life will get difficult, you will be the first to bash the government. It's digesting that Ukraine's own neighborhood has countries buying oil from Russia. We don't have to take a moral high ground, the governments job is to serve it's people",en,[],[],[],1,1,5,[],[],https://twitter.com/AbeTheApe96/status/1504297865237397507,False,,0,,,,,,,,"[{'screen_name': 'nehem00', 'name': 'Nehem', 'id': '136721570'}, {'screen_name': 'rajiv132', 'name': 'Rajiv Babu', 'id': '18187061'}, {'screen_name': 'Swamy39', 'name': 'Subramanian Swamy', 'id': '60937837'}]",,,,
1504292878025113604,1504160324991451136,2022-03-17 04:05:45 +01,2022-03-17,04:05:45,+0100,2191984092,orwell4ever,Mark Wayne,,@olgatokariuk Ukraine asked to be pawns in a proxy war where they would be the biggest losers with Russia. Now they are facing reality that pawns die in war while big powers look on from the sidelines putting just enough arms petrol on the fire while keeping out of their own proxy pawn war.,en,[],[],[],0,0,0,[],[],https://twitter.com/orwell4ever/status/1504292878025113604,False,,0,,,,,,,,"[{'screen_name': 'olgatokariuk', 'name': 'Olga Tokariuk', 'id': '1359532099'}]",,,,
1504285818717757446,1488100998321098754,2022-03-17 03:37:42 +01,2022-03-17,03:37:42,+0100,57248499,7newsperth,7NEWS Perth,,"Motorists shouldn’t expect relief at the petrol bowser any time soon, even though global crude oil prices dropped further to below $US100 a barrel on hopes of progress in Russia-Ukraine peace talks. #7NEWS  https://t.co/69Ge9CNc96",en,[],['https://7news.com.au/business/money/fuel-predictions-reveal-petrol-prices-are-set-to-rise-even-further-c-6089179'],[],1,0,0,['7news'],[],https://twitter.com/7NewsPerth/status/1504285818717757446,False,,0,,,,,,,,[],,,,
1504285646411628546,1501095731146690560,2022-03-17 03:37:01 +01,2022-03-17,03:37:01,+0100,269581619,7newsadelaide,7NEWS Adelaide,,"Motorists shouldn’t expect relief at the petrol bowser any time soon, even though global crude oil prices dropped further to below $US100 a barrel on hopes of progress in Russia-Ukraine peace talks. #7NEWS  https://t.co/yWyHGK4JRO",en,[],['https://7news.com.au/business/money/fuel-predictions-reveal-petrol-prices-are-set-to-rise-even-further-c-6089179'],[],0,0,0,['7news'],[],https://twitter.com/7NewsAdelaide/status/1504285646411628546,False,,0,,,,,,,,[],,,,
1504285495349886976,1501827713971019776,2022-03-17 03:36:25 +01,2022-03-17,03:36:25,+0100,121639467,7newsmelbourne,7NEWS Melbourne,,"Motorists shouldn’t expect relief at the petrol bowser any time soon, even though global crude oil prices dropped further to below $US100 a barrel on hopes of progress in Russia-Ukraine peace talks. #7NEWS  https://t.co/Nwoljj5zaH",en,[],['https://7news.com.au/business/money/fuel-predictions-reveal-petrol-prices-are-set-to-rise-even-further-c-6089179'],[],0,1,2,['7news'],[],https://twitter.com/7NewsMelbourne/status/1504285495349886976,False,,0,,,,,,,,[],,,,
1504283394141683715,1503282886178668548,2022-03-17 03:28:04 +01,2022-03-17,03:28:04,+0100,74382140,7newsbrisbane,7NEWS Brisbane,,"Motorists shouldn’t expect relief at the petrol bowser any time soon, even though global crude oil prices dropped further to below $US100 a barrel on hopes of progress in Russia-Ukraine peace talks. #7NEWS  https://t.co/LzF7hBLaIO",en,[],['https://7news.com.au/business/money/fuel-predictions-reveal-petrol-prices-are-set-to-rise-even-further-c-6089179'],[],0,0,3,['7news'],[],https://twitter.com/7NewsBrisbane/status/1504283394141683715,False,,0,,,,,,,,[],,,,
1504283285203030019,1502911987663065088,2022-03-17 03:27:38 +01,2022-03-17,03:27:38,+0100,1098451166306824193,7newscanberra,7NEWS Canberra,,"Motorists shouldn’t expect relief at the petrol bowser any time soon, even though global crude oil prices dropped further to below $US100 a barrel on hopes of progress in Russia-Ukraine peace talks. #7NEWS  https://t.co/CJLPkySytl",en,[],['https://7news.com.au/business/money/fuel-predictions-reveal-petrol-prices-are-set-to-rise-even-further-c-6089179'],[],0,0,0,['7news'],[],https://twitter.com/7NewsCanberra/status/1504283285203030019,False,,0,,,,,,,,[],,,,
1504283212972843011,1503543135288250371,2022-03-17 03:27:20 +01,2022-03-17,03:27:20,+0100,63362429,7newsaustralia,7NEWS Australia,,"Motorists shouldn’t expect relief at the petrol bowser any time soon, even though global crude oil prices dropped further to below $US100 a barrel on hopes of progress in Russia-Ukraine peace talks. #7NEWS  https://t.co/isUUmcjVx0",en,[],['https://7news.com.au/business/money/fuel-predictions-reveal-petrol-prices-are-set-to-rise-even-further-c-6089179'],[],1,0,1,['7news'],[],https://twitter.com/7NewsAustralia/status/1504283212972843011,False,,0,,,,,,,,[],,,,
1504283110044672002,1504013096490176515,2022-03-17 03:26:56 +01,2022-03-17,03:26:56,+0100,156464691,7newssydney,7NEWS Sydney,,"Motorists shouldn’t expect relief at the petrol bowser any time soon, even though global crude oil prices dropped further to below $US100 a barrel on hopes of progress in Russia-Ukraine peace talks. #7NEWS  https://t.co/iSvTQrQKbl",en,[],['https://7news.com.au/business/money/fuel-predictions-reveal-petrol-prices-are-set-to-rise-even-further-c-6089179'],[],0,0,2,['7news'],[],https://twitter.com/7NewsSydney/status/1504283110044672002,False,,0,,,,,,,,[],,,,
1504276202281873412,1504162204244918274,2022-03-17 02:59:29 +01,2022-03-17,02:59:29,+0100,1470794287499530241,radiant_katie,RadiantKatie,,@CortesSteve Remember we financed the Russian siege of Ukraine through our petrol dollars buying Russian barrels of oil. This is crazy. We have given Russia much more money for oil than what was authorized for Ukraine defense. Whose side are we on? Russia should've been cut off 6 months ago.,en,[],[],[],0,0,0,[],[],https://twitter.com/radiant_katie/status/1504276202281873412,False,,0,,,,,,,,"[{'screen_name': 'CortesSteve', 'name': 'Steve Cortes', 'id': '229141520'}]",,,,
1504275722223120385,1504263487157067783,2022-03-17 02:57:34 +01,2022-03-17,02:57:34,+0100,1427387278045810706,chutzpahx,Victor #AlboForPM,,@JoshFrydenberg Your toast...lol The ALP continues to hold a commanding lead over the L-NP as the Russia-Ukraine war continues and petrol prices spike: ALP 56% cf. L-NP 44%,en,[],[],[],0,1,13,[],[],https://twitter.com/Chutzpahx/status/1504275722223120385,False,,0,,,,,,,,"[{'screen_name': 'JoshFrydenberg', 'name': 'Josh Frydenberg', 'id': '63942152'}]",,,,
1504264599620755457,1504264599620755457,2022-03-17 02:13:23 +01,2022-03-17,02:13:23,+0100,29853062,traikes,raikesy,,In my latest article I take a look at the uncertainty that war brings and the global effects on #inflation and costs for fuel and oil.  #markets #oil #stocks #russiaukrainecrisis #russiaukraine #russiaukraineconflict #petrol #etfs #betashares #gold    https://t.co/4QQD7XB31H,en,[],['https://cstu.io/92d230'],[],1,0,0,"['inflation', 'markets', 'oil', 'stocks', 'russiaukrainecrisis', 'russiaukraine', 'russiaukraineconflict', 'petrol', 'etfs', 'betashares', 'gold']",[],https://twitter.com/traikes/status/1504264599620755457,False,,0,,,,,,,,[],,,,
1504262750251499521,1504262750251499521,2022-03-17 02:06:02 +01,2022-03-17,02:06:02,+0100,44835347,theprojecttv,The Project,,"Motorists shouldn't expect relief at the petrol bowser any time soon, even though global crude oil prices dropped further to below $US100 a barrel on hopes of progress in Russia-Ukraine peace talks.   https://t.co/50JEUtLlHN",en,[],['https://fal.cn/3n0b6'],[],0,1,2,[],[],https://twitter.com/theprojecttv/status/1504262750251499521,False,,0,,,,,,,,[],,,,
1504261271398481925,1279203337338974208,2022-03-17 02:00:09 +01,2022-03-17,02:00:09,+0100,505196984,cyberspec1,Tony,,#RussiaUkraine #PetrolDieselPrice #France Protesting French Farmers dumping rubbish in front of government offices due to high Petrol &amp; Diesel prices  https://t.co/u7y4boMKA9,en,[],[],[],2,17,44,"['russiaukraine', 'petroldieselprice', 'france']",[],https://twitter.com/Cyberspec1/status/1504261271398481925,False,,1,https://pbs.twimg.com/ext_tw_video_thumb/1504261199541661697/pu/img/X1b9BCDbhq9y1E4w.jpg,,,,,,,[],,,,
1504260708573143041,1279203337338974208,2022-03-17 01:57:55 +01,2022-03-17,01:57:55,+0100,505196984,cyberspec1,Tony,,#RussiaUkraine #PetrolDieselPrice  Petrol Station in #Germany placed a notice on front door asking customers to forward numerous complaints about Petrol prices to the German government...  https://t.co/P0wxSMbIPJ,en,[],[],['https://pbs.twimg.com/media/FOA0-yYVcAAOdaA.jpg'],1,9,17,"['russiaukraine', 'petroldieselprice', 'germany']",[],https://twitter.com/Cyberspec1/status/1504260708573143041,False,,1,https://pbs.twimg.com/media/FOA0-yYVcAAOdaA.jpg,,,,,,,[],,,,
1504254647040724996,1504254647040724996,2022-03-17 01:33:50 +01,2022-03-17,01:33:50,+0100,973385868202389504,lecmartnews,Lecmart,,"Oil Price Hits $110, Highest in 8 Years Due to Russia-Ukraine War. Will Petrol Price Increase Soon?  https://t.co/8KrE2dG5aN",en,[],['https://lecmart.com/oil-price-hits-110-highest-in-8-years-due-to-russia-ukraine-war-will-petrol-price-increase-soon/'],[],0,0,0,[],[],https://twitter.com/lecmartnews/status/1504254647040724996,False,,0,,,,,,,,[],,,,
1504251814845288448,1504251814845288448,2022-03-17 01:22:34 +01,2022-03-17,01:22:34,+0100,1477437931866443778,syrupguppy,call me whatever,,“This war doesnt affect us” where do u think ur wheat and petrol comes from 25% of wheat production is done by russia n ukraine there gonna be changing us a fiver a slice. Am no ready for that commitment,en,[],[],[],0,1,8,[],[],https://twitter.com/syrupguppy/status/1504251814845288448,False,,0,,,,,,,,[],,,,
1504246169685352456,1504246169685352456,2022-03-17 01:00:09 +01,2022-03-17,01:00:09,+0100,822792065188827136,duddleyduddley,Duddley,,"#UKRAINE  THREE PROBLEMS FOR RUSSIA  ✅ARMY: made of reservist &amp; part-time soldiers  ✅EQUIPMENT: a curious mix of antiquated &amp; hypermodern #Russian tech  ✅SUPPLYLINES: woefully lacking (trucks w/o petrol, soldiers w/o adequate food)  #RussiaUkraineWar #UkraineWar #Putin #Russia  https://t.co/ngQB1jwHkt",en,[],[],['https://pbs.twimg.com/media/FOAnKpaXIAU8sZa.jpg'],0,2,1,"['ukraine', 'russian', 'russiaukrainewar', 'ukrainewar', 'putin', 'russia']",[],https://twitter.com/DuddleyDuddley/status/1504246169685352456,False,,1,https://pbs.twimg.com/media/FOAnKpaXIAU8sZa.jpg,,,,,,,[],,,,
1504227651850244097,1504126542770683904,2022-03-16 23:46:34 +01,2022-03-16,23:46:34,+0100,1357577402252095490,misterdon87,Holdoon87,,"@reformist__ @ajaidepp Lah? Ni benda basic formula sama , harga minyak ron97 diapungkan. Bila ada krisis russia ukraine. Minyak brent dah naik. Lebih pada 120 usd per barrel. Apa kaitan PH dengan BN pulak? Yang bertambah tu subisidy petrol ron95",in,[],[],[],1,7,29,[],[],https://twitter.com/misterdon87/status/1504227651850244097,False,,0,,,,,,,,"[{'screen_name': 'reformist__', 'name': 'REFORMIST', 'id': '823778813150576641'}, {'screen_name': 'ajaidepp', 'name': 'ₜᵤₖₐₙg ₗᵢₚₐₜ ₚₚₑ', 'id': '227682984'}]",,,,
1504205878077140992,1504205878077140992,2022-03-16 22:20:02 +01,2022-03-16,22:20:02,+0100,44310665,city_press,City Press,,"South Africans could potentially be forking out R24/l for petrol and R23.60/l for diesel in April, according to the Automobile Association's forecast. This amid the ongoing Russia-Ukraine conflict and concerns about oil supply  https://t.co/uGPz3N5lEK.  https://t.co/f7WkCCqikF",en,[],['http://ow.ly/KOTN50IkEEO'],['https://pbs.twimg.com/media/FOADRldXIAIJtoP.jpg'],2,3,4,[],[],https://twitter.com/City_Press/status/1504205878077140992,False,,1,https://pbs.twimg.com/media/FOADRldXIAIJtoP.jpg,,,,,,,[],,,,
1504198386303619081,1504198386303619081,2022-03-16 21:50:16 +01,2022-03-16,21:50:16,+0100,3375466684,poetryfordonkey,towards the future⬆️ 🇪🇺🇲🇫,,"Oh yes. I think sanctions must continue even if Russia gets out of Ukraine. Or do we tell the oligarchs, here, take back your yacht, football clubs and be pals again? Does Germany joyfully jump back on the petrol express because its beautiful and they can? Do we forget the dead?",en,[],[],[],0,1,1,[],[],https://twitter.com/poetryfordonkey/status/1504198386303619081,False,https://twitter.com/Kasparov63/status/1504111531797143553,0,,,,,,,,[],,,,
